relevant,"post name","link notes","comments notes","comments link","post link","match path","subreddit path","time path","date path","subreddit title","time title","date title"
1,"The &quot;dress codes are sexist&quot; rhetoric gets destroyed on Facebook.",,,"data/data_collection/16-10-10 v1/12-58-26 SAVE v1/antiFeminist-TumblrInAction/The_quotdress_codes_are_sexist/The_quotdress_codes_are_sexist___COMMENTS.html","data/data_collection/16-10-10 v1/12-58-26 SAVE v1/antiFeminist-TumblrInAction/The_quotdress_codes_are_sexist/The_quotdress_codes_are_sexist___LINK.html","data/data_collection/16-10-10 v1/12-58-26 SAVE v1/antiFeminist-TumblrInAction/The_quotdress_codes_are_sexist","data/data_collection/16-10-10 v1/12-58-26 SAVE v1/antiFeminist-TumblrInAction","data/data_collection/16-10-10 v1/12-58-26 SAVE v1","data/data_collection/16-10-10 v1",antiFeminist-TumblrInAction,"12-58-26 SAVE v1","16-10-10 v1"
0,"[product question] Glycoderma Resurfacing Facial Cream 25% glycolic acid night cream",,,"data/data_collection/16-10-10 v1/12-58-26 SAVE v1/feminineCentric-skincareaddiction/product_question_Glycoderma_Re/product_question_Glycoderma_Re___COMMENTS.html","data/data_collection/16-10-10 v1/12-58-26 SAVE v1/feminineCentric-skincareaddiction/product_question_Glycoderma_Re/product_question_Glycoderma_Re___LINK.html","data/data_collection/16-10-10 v1/12-58-26 SAVE v1/feminineCentric-skincareaddiction/product_question_Glycoderma_Re","data/data_collection/16-10-10 v1/12-58-26 SAVE v1/feminineCentric-skincareaddiction","data/data_collection/16-10-10 v1/12-58-26 SAVE v1","data/data_collection/16-10-10 v1",feminineCentric-skincareaddiction,"12-58-26 SAVE v1","16-10-10 v1"
1,"John Oliver: &quot;If American democracy is a computer game, and Hillary is completing women's 100-year quest to get to the oval office, it kind of makes sense that [Trump] would be the final boss.&quot;",,,"data/data_collection/16-10-10 v1/12-58-26 SAVE v1/feminist-feminism/John_Oliver_quotIf_American_de/John_Oliver_quotIf_American_de___COMMENTS.html","data/data_collection/16-10-10 v1/12-58-26 SAVE v1/feminist-feminism/John_Oliver_quotIf_American_de/John_Oliver_quotIf_American_de___LINK.html","data/data_collection/16-10-10 v1/12-58-26 SAVE v1/feminist-feminism/John_Oliver_quotIf_American_de","data/data_collection/16-10-10 v1/12-58-26 SAVE v1/feminist-feminism","data/data_collection/16-10-10 v1/12-58-26 SAVE v1","data/data_collection/16-10-10 v1",feminist-feminism,"12-58-26 SAVE v1","16-10-10 v1"
0,"/u/anticode gives a great metaphor for having a personal meaning after leaving a religion",,,"data/data_collection/16-10-10 v1/12-58-26 SAVE v1/general-bestof/uanticode_gives_a_great_metaph/uanticode_gives_a_great_metaph___COMMENTS.html","data/data_collection/16-10-10 v1/12-58-26 SAVE v1/general-bestof/uanticode_gives_a_great_metaph/uanticode_gives_a_great_metaph___LINK.html","data/data_collection/16-10-10 v1/12-58-26 SAVE v1/general-bestof/uanticode_gives_a_great_metaph","data/data_collection/16-10-10 v1/12-58-26 SAVE v1/general-bestof","data/data_collection/16-10-10 v1/12-58-26 SAVE v1","data/data_collection/16-10-10 v1",general-bestof,"12-58-26 SAVE v1","16-10-10 v1"
0,"My friend Vanessa only cares about her self...",,,"data/data_collection/16-10-10 v1/12-58-26 SAVE v1/general-frontpage/My_friend_Vanessa_only_cares_a/My_friend_Vanessa_only_cares_a___COMMENTS.html","data/data_collection/16-10-10 v1/12-58-26 SAVE v1/general-frontpage/My_friend_Vanessa_only_cares_a/My_friend_Vanessa_only_cares_a___LINK.html","data/data_collection/16-10-10 v1/12-58-26 SAVE v1/general-frontpage/My_friend_Vanessa_only_cares_a","data/data_collection/16-10-10 v1/12-58-26 SAVE v1/general-frontpage","data/data_collection/16-10-10 v1/12-58-26 SAVE v1","data/data_collection/16-10-10 v1",general-frontpage,"12-58-26 SAVE v1","16-10-10 v1"
0,"Swedish Police Woman (1970s)",,,"data/data_collection/16-10-10 v1/12-58-26 SAVE v1/general-frontpage/Swedish_Police_Woman_1970/Swedish_Police_Woman_1970___COMMENTS.html","data/data_collection/16-10-10 v1/12-58-26 SAVE v1/general-frontpage/Swedish_Police_Woman_1970/Swedish_Police_Woman_1970___LINK.html","data/data_collection/16-10-10 v1/12-58-26 SAVE v1/general-frontpage/Swedish_Police_Woman_1970","data/data_collection/16-10-10 v1/12-58-26 SAVE v1/general-frontpage","data/data_collection/16-10-10 v1/12-58-26 SAVE v1","data/data_collection/16-10-10 v1",general-frontpage,"12-58-26 SAVE v1","16-10-10 v1"
0,"For all the kids today complaining about how horrible their computer is, you will never know this struggle",,,"data/data_collection/16-10-10 v1/12-58-26 SAVE v1/general-funny/For_all_the_kids_today_complai/For_all_the_kids_today_complai___COMMENTS.html","data/data_collection/16-10-10 v1/12-58-26 SAVE v1/general-funny/For_all_the_kids_today_complai/For_all_the_kids_today_complai___LINK.html","data/data_collection/16-10-10 v1/12-58-26 SAVE v1/general-funny/For_all_the_kids_today_complai","data/data_collection/16-10-10 v1/12-58-26 SAVE v1/general-funny","data/data_collection/16-10-10 v1/12-58-26 SAVE v1","data/data_collection/16-10-10 v1",general-funny,"12-58-26 SAVE v1","16-10-10 v1"
0,"My buddy is going through a rough time right now so I let him crash at my pad this week while I was out of town. He was nice enough to do his own dishes.",,,"data/data_collection/16-10-10 v1/12-58-26 SAVE v1/general-pics/My_buddy_is_going_through_a_ro/My_buddy_is_going_through_a_ro___COMMENTS.html","data/data_collection/16-10-10 v1/12-58-26 SAVE v1/general-pics/My_buddy_is_going_through_a_ro/My_buddy_is_going_through_a_ro___LINK.html","data/data_collection/16-10-10 v1/12-58-26 SAVE v1/general-pics/My_buddy_is_going_through_a_ro","data/data_collection/16-10-10 v1/12-58-26 SAVE v1/general-pics","data/data_collection/16-10-10 v1/12-58-26 SAVE v1","data/data_collection/16-10-10 v1",general-pics,"12-58-26 SAVE v1","16-10-10 v1"
0,"My dad recently passed away in my arms. I'm really struggling. I just wanted to show someone this. Its the most cherished thing I'll ever own",,,"data/data_collection/16-10-10 v1/12-58-26 SAVE v1/general-pics/My_dad_recently_passed_away_in/My_dad_recently_passed_away_in___COMMENTS.html","data/data_collection/16-10-10 v1/12-58-26 SAVE v1/general-pics/My_dad_recently_passed_away_in/My_dad_recently_passed_away_in___LINK.html","data/data_collection/16-10-10 v1/12-58-26 SAVE v1/general-pics/My_dad_recently_passed_away_in","data/data_collection/16-10-10 v1/12-58-26 SAVE v1/general-pics","data/data_collection/16-10-10 v1/12-58-26 SAVE v1","data/data_collection/16-10-10 v1",general-pics,"12-58-26 SAVE v1","16-10-10 v1"
0,"TIL A man can divorce his wife in Islam simply by saying 'Talaq' ('I divorce you') three times to his wife.",,,"data/data_collection/16-10-10 v1/12-58-26 SAVE v1/general-todayilearned/TIL_A_man_can_divorce_his_wife/TIL_A_man_can_divorce_his_wife___COMMENTS.html","data/data_collection/16-10-10 v1/12-58-26 SAVE v1/general-todayilearned/TIL_A_man_can_divorce_his_wife/TIL_A_man_can_divorce_his_wife___LINK.html","data/data_collection/16-10-10 v1/12-58-26 SAVE v1/general-todayilearned/TIL_A_man_can_divorce_his_wife","data/data_collection/16-10-10 v1/12-58-26 SAVE v1/general-todayilearned","data/data_collection/16-10-10 v1/12-58-26 SAVE v1","data/data_collection/16-10-10 v1",general-todayilearned,"12-58-26 SAVE v1","16-10-10 v1"
0,"TIL that the SS officer who arrested Anne Frank and the other inhabitants of the secret annex later bought her book to see if he was in it. (He wasn't.)",,,"data/data_collection/16-10-10 v1/12-58-26 SAVE v1/general-todayilearned/TIL_that_the_SS_officer_who_ar/TIL_that_the_SS_officer_who_ar___COMMENTS.html","data/data_collection/16-10-10 v1/12-58-26 SAVE v1/general-todayilearned/TIL_that_the_SS_officer_who_ar/TIL_that_the_SS_officer_who_ar___LINK.html","data/data_collection/16-10-10 v1/12-58-26 SAVE v1/general-todayilearned/TIL_that_the_SS_officer_who_ar","data/data_collection/16-10-10 v1/12-58-26 SAVE v1/general-todayilearned","data/data_collection/16-10-10 v1/12-58-26 SAVE v1","data/data_collection/16-10-10 v1",general-todayilearned,"12-58-26 SAVE v1","16-10-10 v1"
0,"A native Unix shell for Windows to speed up builds of GNU-like projects",,,"data/data_collection/16-10-10 v1/12-58-26 SAVE v1/technology-programming/A_native_Unix_shell_for_Window/A_native_Unix_shell_for_Window___COMMENTS.html","data/data_collection/16-10-10 v1/12-58-26 SAVE v1/technology-programming/A_native_Unix_shell_for_Window/A_native_Unix_shell_for_Window___LINK.html","data/data_collection/16-10-10 v1/12-58-26 SAVE v1/technology-programming/A_native_Unix_shell_for_Window","data/data_collection/16-10-10 v1/12-58-26 SAVE v1/technology-programming","data/data_collection/16-10-10 v1/12-58-26 SAVE v1","data/data_collection/16-10-10 v1",technology-programming,"12-58-26 SAVE v1","16-10-10 v1"
1,"&quot;Let me just put my husband on who knows about computers...&quot;",,,"data/data_collection/16-10-10 v1/12-58-26 SAVE v1/technology-talesfromtechsupport/quotLet_me_just_put_my_husband/quotLet_me_just_put_my_husband___COMMENTS.html","data/data_collection/16-10-10 v1/12-58-26 SAVE v1/technology-talesfromtechsupport/quotLet_me_just_put_my_husband/quotLet_me_just_put_my_husband___LINK.html","data/data_collection/16-10-10 v1/12-58-26 SAVE v1/technology-talesfromtechsupport/quotLet_me_just_put_my_husband","data/data_collection/16-10-10 v1/12-58-26 SAVE v1/technology-talesfromtechsupport","data/data_collection/16-10-10 v1/12-58-26 SAVE v1","data/data_collection/16-10-10 v1",technology-talesfromtechsupport,"12-58-26 SAVE v1","16-10-10 v1"
0,"someone brandished a gun on me.",,,"data/data_collection/16-10-10 v1/12-58-26 SAVE v1/technology-talesfromtechsupport/someone_brandished_a_gun_on_m/someone_brandished_a_gun_on_m___COMMENTS.html","data/data_collection/16-10-10 v1/12-58-26 SAVE v1/technology-talesfromtechsupport/someone_brandished_a_gun_on_m/someone_brandished_a_gun_on_m___LINK.html","data/data_collection/16-10-10 v1/12-58-26 SAVE v1/technology-talesfromtechsupport/someone_brandished_a_gun_on_m","data/data_collection/16-10-10 v1/12-58-26 SAVE v1/technology-talesfromtechsupport","data/data_collection/16-10-10 v1/12-58-26 SAVE v1","data/data_collection/16-10-10 v1",technology-talesfromtechsupport,"12-58-26 SAVE v1","16-10-10 v1"
1,"Hillary Clinton vs. Donald Trump on broadband: She has a plan, he doesn’t Clinton vows to defend net neutrality—Trump calls it “attack on the Internet.&quot;",,,"data/data_collection/16-10-10 v1/12-58-26 SAVE v1/technology-technology/Hillary_Clinton_vs_Donald_Trum/Hillary_Clinton_vs_Donald_Trum___COMMENTS.html","data/data_collection/16-10-10 v1/12-58-26 SAVE v1/technology-technology/Hillary_Clinton_vs_Donald_Trum/Hillary_Clinton_vs_Donald_Trum___LINK.html","data/data_collection/16-10-10 v1/12-58-26 SAVE v1/technology-technology/Hillary_Clinton_vs_Donald_Trum","data/data_collection/16-10-10 v1/12-58-26 SAVE v1/technology-technology","data/data_collection/16-10-10 v1/12-58-26 SAVE v1","data/data_collection/16-10-10 v1",technology-technology,"12-58-26 SAVE v1","16-10-10 v1"
